{
  "schemaVersion": "1",
  "type": "stunt",
  "name": "Resolute",
  "description": "In order to steel myself to action, I get +2 to a Will roll to Create an Advantage representing my decision to follow through on that action. The Aspect created can be used to resist efforts to stop me completing the action.",
  "mechanics": [
    {
      "mechanicType": "dice-roll",
      "parameters": {
        "trait": "Will",
        "modifier": 2,
        "actions": [
          "CaA"
        ]
      }
    }
  ]
}